{
  "format": 1,
  "generatedAt": "2026-10-18T01:17:00Z",
  "sdk": 37,
  "source": {
    "declarations": "manual",
    "note": "Entries typed by hand from each app's Play Store page. No automatic source is in use."
  },
  "dataTypesByGroup": {
    "LOCATION": [
      "Location"
    ],
    "CAMERA": [
      "Photos and videos"
    ],
    "MICROPHONE": [
      "Audio"
    ],
    "CONTACTS": [
      "Contacts"
    ],
    "CALENDAR": [
      "Calendar"
    ],
    "PHONE": [
      "Personal info",
      "Device or other IDs"
    ],
    "CALL_LOG": [
      "Personal info"
    ],
    "SMS": [
      "Messages"
    ],
    "BODY_SENSORS": [
      "Health and fitness"
    ],
    "ACTIVITY": [
      "Health and fitness"
    ],
    "NEARBY_DEVICES": [
      "Device or other IDs"
    ],
    "FILES_AND_MEDIA": [
      "Photos and videos",
      "Files and docs",
      "Audio"
    ]
  },
  "apps": {
    "ai.x.grok": {
      "name": "Grok",
      "developer": "SpaceXAI",
      "policyUrl": "https://x.ai/legal/privacy-policy",
      "readAt": "2026-10-17",
      "versionCode": null,
      "listing": "present",
      "declared": {
        "collected": [
          "Location",
          "Device or other IDs",
          "Personal info",
          "App info and performance",
          "Photos and videos",
          "App activity",
          "Files and docs"
        ],
        "shared": [
          "Device or other IDs",
          "App info and performance",
          "Photos and videos",
          "App activity"
        ]
      }
    },
    "ch.protonmail.android": {
      "name": "Proton Mail: Encrypted Email",
      "developer": "Proton AG",
      "policyUrl": "https://proton.me/legal/privacy",
      "readAt": "2026-10-17",
      "versionCode": null,
      "listing": "present",
      "declared": {
        "collected": [
          "App activity",
          "Contacts",
          "Personal info",
          "Device or other IDs",
          "App info and performance"
        ],
        "shared": []
      }
    },
    "cn.danatech.xingseus": {
      "name": "PictureThis - Plant Identifier",
      "developer": "Glority Global Group Ltd.",
      "policyUrl": "https://api-java.picturethisai.com/static/privacy_policy.html",
      "readAt": "2026-10-17",
      "versionCode": null,
      "listing": "present",
      "declared": {
        "collected": [
          "App info and performance",
          "App activity",
          "Personal info",
          "Device or other IDs",
          "Photos and videos",
          "Financial info"
        ],
        "shared": [
          "App info and performance",
          "App activity",
          "Personal info",
          "Device or other IDs",
          "Financial info"
        ]
      }
    },
    "co.windyapp.android": {
      "name": "Windy.app - Enhanced forecast",
      "developer": "Windy Weather World Inc",
      "policyUrl": "http://www.windyapp.co/CustomMenuItems/26/en",
      "readAt": "2026-10-17",
      "versionCode": null,
      "listing": "present",
      "declared": {
        "collected": [
          "App info and performance",
          "App activity",
          "Personal info"
        ],
        "shared": [
          "App info and performance",
          "Location",
          "App activity",
          "Device or other IDs"
        ]
      }
    },
    "com.DeltaDefense.ReciprocityByUSCCA": {
      "name": "Reciprocity",
      "developer": null,
      "policyUrl": null,
      "readAt": "2026-10-17",
      "versionCode": null,
      "listing": "removed",
      "declared": null
    },
    "com.DeltaDefense.playstore.uscca": {
      "name": "USCCA Concealed Carry App",
      "developer": "The USCCA",
      "policyUrl": "https://www.usconcealedcarry.com/privacy-policy/",
      "readAt": "2026-10-17",
      "versionCode": null,
      "listing": "present",
      "declared": {
        "collected": [
          "Device or other IDs",
          "App info and performance",
          "Personal info",
          "App activity"
        ],
        "shared": [
          "Device or other IDs"
        ]
      }
    },
    "com.airbnb.android": {
      "name": "Airbnb",
      "developer": "Airbnb",
      "policyUrl": "https://www.airbnb.com/help/article/2855/",
      "readAt": "2026-10-17",
      "versionCode": null,
      "listing": "present",
      "declared": {
        "collected": [
          "Contacts",
          "Device or other IDs",
          "App info and performance",
          "Personal info",
          "Location",
          "App activity",
          "Messages",
          "Files and docs",
          "Financial info"
        ],
        "shared": [
          "Device or other IDs",
          "Personal info",
          "Location",
          "App activity",
          "Financial info"
        ]
      }
    },
    "com.amazon.mShop.android.shopping": {
      "name": "Amazon Shopping",
      "developer": "Amazon Mobile LLC",
      "policyUrl": "https://www.amazon.com/gp/help/customer/display.html?nodeId=GX7NJQ4ZB8MHFRNJ",
      "readAt": "2026-10-17",
      "versionCode": null,
      "listing": "present",
      "declared": {
        "collected": [
          "App activity",
          "Location",
          "Financial info",
          "Audio",
          "Photos and videos",
          "Personal info",
          "Device or other IDs",
          "Messages",
          "App info and performance",
          "Files and docs",
          "Health and fitness"
        ],
        "shared": [
          "App activity",
          "Financial info",
          "Photos and videos",
          "Personal info",
          "Device or other IDs",
          "Health and fitness"
        ]
      }
    },
    "com.android.chrome": {
      "name": "Google Chrome",
      "developer": "Google LLC",
      "policyUrl": null,
      "readAt": "2026-10-17",
      "versionCode": null,
      "listing": "present",
      "declared": {
        "collected": [
          "App info and performance",
          "Financial info",
          "Personal info",
          "Web browsing",
          "Audio",
          "Photos and videos",
          "Files and docs",
          "App activity",
          "Location"
        ],
        "shared": []
      }
    },
    "com.anonyome.mysudo": {
      "name": "MySudo - Identity Protection",
      "developer": "Anonyome Labs, Inc",
      "policyUrl": "https://anonyome.com/privacy-policy/",
      "readAt": "2026-10-17",
      "versionCode": null,
      "listing": "present",
      "declared": {
        "collected": [
          "Personal info",
          "Financial info",
          "App activity",
          "App info and performance"
        ],
        "shared": []
      }
    },
    "com.anthropic.claude": {
      "name": "Claude by Anthropic",
      "developer": "Anthropic PBC",
      "policyUrl": "https://www.anthropic.com/legal/privacy",
      "readAt": "2026-10-17",
      "versionCode": null,
      "listing": "present",
      "declared": {
        "collected": [
          "App info and performance",
          "App activity",
          "Files and docs",
          "Photos and videos",
          "Location",
          "Device or other IDs",
          "Personal info"
        ],
        "shared": [
          "App info and performance",
          "App activity",
          "Location",
          "Personal info"
        ]
      }
    },
    "com.att.myWireless": {
      "name": "AT&T",
      "developer": "AT&T Services, Inc.",
      "policyUrl": "http://www.att.com/privacypolicy",
      "readAt": "2026-10-17",
      "versionCode": null,
      "listing": "present",
      "declared": {
        "collected": [
          "Location"
        ],
        "shared": [
          "Device or other IDs"
        ]
      }
    },
    "com.aviatorassistant.weather": {
      "name": "Weather Scope NOAA Live Radar",
      "developer": "Aviator Assistant",
      "policyUrl": "https://aviatorassistant.com/privacy",
      "readAt": "2026-10-17",
      "versionCode": null,
      "listing": "present",
      "declared": {
        "collected": [
          "Device or other IDs",
          "Location",
          "App activity",
          "App info and performance"
        ],
        "shared": []
      }
    },
    "com.azure.authenticator": {
      "name": "Microsoft Authenticator",
      "developer": "Microsoft Corporation",
      "policyUrl": "http://go.microsoft.com/fwlink/?linkid=282053",
      "readAt": "2026-10-17",
      "versionCode": null,
      "listing": "present",
      "declared": {
        "collected": [
          "Location"
        ],
        "shared": [
          "Location",
          "App activity"
        ]
      }
    },
    "com.bestbuy.android": {
      "name": "Best Buy: Shop tech deals",
      "developer": "Best Buy Co., Inc",
      "policyUrl": "http://www.bestbuy.com/privacy",
      "readAt": "2026-10-17",
      "versionCode": null,
      "listing": "present",
      "declared": {
        "collected": [
          "Personal info",
          "App activity",
          "Location",
          "Photos and videos",
          "Device or other IDs",
          "Financial info"
        ],
        "shared": [
          "Personal info",
          "App activity",
          "Location",
          "App info and performance",
          "Photos and videos",
          "Device or other IDs",
          "Financial info"
        ]
      }
    },
    "com.bible.alarm.clock": {
      "name": "Bible Alarm: Holy Bible Study",
      "developer": "Bíblia Offline",
      "policyUrl": null,
      "readAt": "2026-10-17",
      "versionCode": null,
      "listing": "present",
      "declared": {
        "collected": [],
        "shared": [
          "Device or other IDs",
          "App info and performance",
          "Personal info",
          "App activity"
        ]
      }
    },
    "com.cedarelectronics.smartsight": {
      "name": "Drive Smarter",
      "developer": "Cedar Electronics",
      "policyUrl": "https://drivesmarter.com/support/privacy-policy/",